[
  {
    "id": "coffee",
    "name": "Coffee (cappuccino)",
    "category": "Food & Drink",
    "short": "coffee",
    "unitSingular": "coffee",
    "unitPlural": "coffees",
    "prices": {
      "USD": 5.47,
      "GBP": 3.59,
      "EUR": 3.61,
      "CAD": 5.33,
      "AUD": 5.65
    },
    "source": "https://www.numbeo.com/cost-of-living/country_result.jsp?country=United+States&displayCurrency=USD",
    "sources": {
      "USD": "https://www.numbeo.com/cost-of-living/country_result.jsp?country=United+States&displayCurrency=USD",
      "GBP": "https://www.numbeo.com/cost-of-living/country_result.jsp?country=United+Kingdom&displayCurrency=GBP",
      "EUR": "https://www.numbeo.com/cost-of-living/country_result.jsp?country=Germany&displayCurrency=EUR",
      "CAD": "https://www.numbeo.com/cost-of-living/country_result.jsp?country=Canada&displayCurrency=CAD",
      "AUD": "https://www.numbeo.com/cost-of-living/country_result.jsp?country=Australia&displayCurrency=AUD"
    },
    "asOf": "2026-09",
    "note": "Numbeo country averages. EUR uses Germany as the euro-area reference."
  },
  {
    "id": "pint",
    "name": "Draft beer (0.5 L)",
    "category": "Food & Drink",
    "short": "beer",
    "unitSingular": "beer",
    "unitPlural": "beers",
    "prices": {
      "USD": 6.0,
      "GBP": 5.0,
      "EUR": 4.5,
      "CAD": 8.0,
      "AUD": 11.0
    },
    "source": "https://www.numbeo.com/cost-of-living/country_result.jsp?country=United+States&displayCurrency=USD",
    "sources": {
      "USD": "https://www.numbeo.com/cost-of-living/country_result.jsp?country=United+States&displayCurrency=USD",
      "GBP": "https://www.numbeo.com/cost-of-living/country_result.jsp?country=United+Kingdom&displayCurrency=GBP",
      "EUR": "https://www.numbeo.com/cost-of-living/country_result.jsp?country=Germany&displayCurrency=EUR",
      "CAD": "https://www.numbeo.com/cost-of-living/country_result.jsp?country=Canada&displayCurrency=CAD",
      "AUD": "https://www.numbeo.com/cost-of-living/country_result.jsp?country=Australia&displayCurrency=AUD"
    },
    "asOf": "2026-09",
    "note": "Numbeo country averages, 0.5 liter domestic draft."
  },
  {
    "id": "lunch",
    "name": "Lunch (inexpensive eatery)",
    "category": "Food & Drink",
    "short": "lunch",
    "unitSingular": "lunch",
    "unitPlural": "lunches",
    "prices": {
      "USD": 20.0,
      "GBP": 16.0,
      "EUR": 15.0,
      "CAD": 25.0,
      "AUD": 25.0
    },
    "source": "https://www.numbeo.com/cost-of-living/country_result.jsp?country=United+States&displayCurrency=USD",
    "sources": {
      "USD": "https://www.numbeo.com/cost-of-living/country_result.jsp?country=United+States&displayCurrency=USD",
      "GBP": "https://www.numbeo.com/cost-of-living/country_result.jsp?country=United+Kingdom&displayCurrency=GBP",
      "EUR": "https://www.numbeo.com/cost-of-living/country_result.jsp?country=Germany&displayCurrency=EUR",
      "CAD": "https://www.numbeo.com/cost-of-living/country_result.jsp?country=Canada&displayCurrency=CAD",
      "AUD": "https://www.numbeo.com/cost-of-living/country_result.jsp?country=Australia&displayCurrency=AUD"
    },
    "asOf": "2026-09",
    "note": "Numbeo country averages for a meal at an inexpensive restaurant."
  },
  {
    "id": "big-mac",
    "name": "Big Mac",
    "category": "Food & Drink",
    "short": "Big Mac",
    "unitSingular": "Big Mac",
    "unitPlural": "Big Macs",
    "prices": {
      "USD": 6.22,
      "GBP": 5.49,
      "EUR": 6.19,
      "CAD": 8.17,
      "AUD": 8.5
    },
    "source": "https://github.com/TheEconomist/big-mac-data",
    "asOf": "2026-07",
    "note": "The Economist Big Mac Index open dataset, July 2026 vintage, local_price column. EUR is the euro-area figure."
  },
  {
    "id": "milk",
    "name": "Milk (1 liter)",
    "category": "Groceries",
    "short": "milk",
    "unitSingular": "liter of milk",
    "unitPlural": "liters of milk",
    "prices": {
      "USD": 1.06,
      "GBP": 1.25,
      "EUR": 1.17,
      "CAD": 3.11,
      "AUD": 2.48
    },
    "source": "https://www.numbeo.com/cost-of-living/country_result.jsp?country=United+States&displayCurrency=USD",
    "sources": {
      "USD": "https://www.numbeo.com/cost-of-living/country_result.jsp?country=United+States&displayCurrency=USD",
      "GBP": "https://www.numbeo.com/cost-of-living/country_result.jsp?country=United+Kingdom&displayCurrency=GBP",
      "EUR": "https://www.numbeo.com/cost-of-living/country_result.jsp?country=Germany&displayCurrency=EUR",
      "CAD": "https://www.numbeo.com/cost-of-living/country_result.jsp?country=Canada&displayCurrency=CAD",
      "AUD": "https://www.numbeo.com/cost-of-living/country_result.jsp?country=Australia&displayCurrency=AUD"
    },
    "asOf": "2026-09",
    "note": "Numbeo country averages, regular milk per liter."
  },
  {
    "id": "eggs",
    "name": "Eggs (dozen)",
    "category": "Groceries",
    "short": "eggs",
    "unitSingular": "dozen eggs",
    "unitPlural": "dozens of eggs",
    "prices": {
      "USD": 4.31,
      "GBP": 3.07,
      "EUR": 3.4,
      "CAD": 4.97,
      "AUD": 7.2
    },
    "source": "https://www.numbeo.com/cost-of-living/country_result.jsp?country=United+States&displayCurrency=USD",
    "sources": {
      "USD": "https://www.numbeo.com/cost-of-living/country_result.jsp?country=United+States&displayCurrency=USD",
      "GBP": "https://www.numbeo.com/cost-of-living/country_result.jsp?country=United+Kingdom&displayCurrency=GBP",
      "EUR": "https://www.numbeo.com/cost-of-living/country_result.jsp?country=Germany&displayCurrency=EUR",
      "CAD": "https://www.numbeo.com/cost-of-living/country_result.jsp?country=Canada&displayCurrency=CAD",
      "AUD": "https://www.numbeo.com/cost-of-living/country_result.jsp?country=Australia&displayCurrency=AUD"
    },
    "asOf": "2026-09",
    "note": "Numbeo country averages, 12 large eggs."
  },
  {
    "id": "bread",
    "name": "Bread (500 g loaf)",
    "category": "Groceries",
    "short": "bread",
    "unitSingular": "loaf of bread",
    "unitPlural": "loaves of bread",
    "prices": {
      "USD": 3.64,
      "GBP": 1.26,
      "EUR": 1.9,
      "CAD": 3.72,
      "AUD": 3.95
    },
    "source": "https://www.numbeo.com/cost-of-living/country_result.jsp?country=United+States&displayCurrency=USD",
    "sources": {
      "USD": "https://www.numbeo.com/cost-of-living/country_result.jsp?country=United+States&displayCurrency=USD",
      "GBP": "https://www.numbeo.com/cost-of-living/country_result.jsp?country=United+Kingdom&displayCurrency=GBP",
      "EUR": "https://www.numbeo.com/cost-of-living/country_result.jsp?country=Germany&displayCurrency=EUR",
      "CAD": "https://www.numbeo.com/cost-of-living/country_result.jsp?country=Canada&displayCurrency=CAD",
      "AUD": "https://www.numbeo.com/cost-of-living/country_result.jsp?country=Australia&displayCurrency=AUD"
    },
    "asOf": "2026-09",
    "note": "Numbeo country averages, fresh white loaf."
  },
  {
    "id": "chicken",
    "name": "Chicken fillets (2.2 lb / 1 kg)",
    "category": "Groceries",
    "short": "chicken",
    "unitSingular": "kilo of chicken",
    "unitPlural": "kilos of chicken",
    "prices": {
      "USD": 12.38,
      "GBP": 6.8,
      "EUR": 10.33,
      "CAD": 16.76,
      "AUD": 13.15
    },
    "source": "https://www.numbeo.com/cost-of-living/country_result.jsp?country=United+States&displayCurrency=USD",
    "sources": {
      "USD": "https://www.numbeo.com/cost-of-living/country_result.jsp?country=United+States&displayCurrency=USD",
      "GBP": "https://www.numbeo.com/cost-of-living/country_result.jsp?country=United+Kingdom&displayCurrency=GBP",
      "EUR": "https://www.numbeo.com/cost-of-living/country_result.jsp?country=Germany&displayCurrency=EUR",
      "CAD": "https://www.numbeo.com/cost-of-living/country_result.jsp?country=Canada&displayCurrency=CAD",
      "AUD": "https://www.numbeo.com/cost-of-living/country_result.jsp?country=Australia&displayCurrency=AUD"
    },
    "asOf": "2026-09",
    "note": "Numbeo country averages, metric rows."
  },
  {
    "id": "fuel-tank",
    "name": "Tank of gas (13.2 gal / 50 L)",
    "category": "Transport",
    "short": "gas",
    "unitSingular": "tank of gas",
    "unitPlural": "tanks of gas",
    "prices": {
      "USD": 53.77,
      "GBP": 80.81,
      "EUR": 111.8,
      "CAD": 87.05,
      "AUD": 102.4
    },
    "source": "https://www.eia.gov/petroleum/gasdiesel/",
    "sources": {
      "USD": "https://www.eia.gov/petroleum/gasdiesel/",
      "GBP": "https://www.gov.uk/government/statistics/weekly-road-fuel-prices",
      "EUR": "https://energy.ec.europa.eu/data-and-analysis/weekly-oil-bulletin_en",
      "CAD": "https://www.caa.ca/gas-prices/",
      "AUD": "https://www.aip.com.au/pricing"
    },
    "asOf": "2026-08",
    "note": "Derived: official per-liter price x 50 (13.2 gallons). Week ending late August 2026: US EIA regular 4.071 USD/gal (1.0754/L), UK DESNZ 161.61 p/L, EC Oil Bulletin Germany Euro-super 95 2.236 EUR/L, CAA Canada 174.1 c/L, AIP Australia 204.8 c/L."
  },
  {
    "id": "transit-month",
    "name": "Transit pass (monthly)",
    "category": "Transport",
    "short": "transit",
    "unitSingular": "transit pass",
    "unitPlural": "transit passes",
    "prices": {
      "USD": 65.0,
      "GBP": 77.33,
      "EUR": 63.0,
      "CAD": 104.0,
      "AUD": 132.8
    },
    "source": "https://www.numbeo.com/cost-of-living/country_result.jsp?country=United+States&displayCurrency=USD",
    "sources": {
      "USD": "https://www.numbeo.com/cost-of-living/country_result.jsp?country=United+States&displayCurrency=USD",
      "GBP": "https://www.numbeo.com/cost-of-living/country_result.jsp?country=United+Kingdom&displayCurrency=GBP",
      "EUR": "https://www.numbeo.com/cost-of-living/country_result.jsp?country=Germany&displayCurrency=EUR",
      "CAD": "https://www.numbeo.com/cost-of-living/country_result.jsp?country=Canada&displayCurrency=CAD",